|qtr|Form_Type|Company_Name|CIK|Date|Path|Indicator|Phrase
46|q4-15|10-Q|Liberty Interactive Corp|1355096|2015-11-05|http://www.sec.gov/Archives/edgar/data/1355096/000155837015002274|NA|   Concentration of credit risk   The following table summarizes the revenues from customers (including original equipment manufacturers) in excess of 10% of the total revenues for the three and nine months ended September 30, 2015 and 2014:       Three Months Ended   Nine Months Ended       September 30,   September 30,       2015   2014   2015   2014   Hewlett Packard   14  % 15  % 14  % 11  % IBM   *   11  % *   11  % Dell   *   11  % *   11  %     * Less than 10%   The following table summarizes the accounts receivable balance in excess of 10% of the total accounts receivable for the periods indicated:       September 30, 2015   December 31, 2014   Hewlett Packard   20  % 17  % IBM   *   11  % Ingram Micro   *   10  %     * Less than 10% 
47|q4-15|S-1|Genius Brands International, Inc.|1355848|2015-12-14|http://www.sec.gov/Archives/edgar/data/1355848/000101968715004504|NA|Cash Flow Distributions   Cash available for distributions represents the cash funds received by us from operations (other than net proceeds from a capital transaction) that produce proceeds from (1) the repayment of principal or prepayment of a mortgage to the extent classified as a return of capital for federal income tax purposes, (2) the foreclosure, sale, exchange, condemnation, eminent domain taking or other disposition of a mortgage loan or of a property subject to a mortgage, or (3) insurance or a guarantee with respect to a mortgage, including, without limitation, interest, points, revenue participations in property appreciation and interest or dividends from interim investments or proceeds from borrowings, if appropriate, less all cash used to pay Partnership expenses and debt payments and amounts set aside to create a retained earnings reserve (currently at 9.5 % of our net income; the retained earnings reserve is intended to recover some of the organization and offering expenses incurred in connection with our public offering of our units of limited partnership interest).
48|q4-15|S-1|Genius Brands International, Inc.|1355848|2015-12-14|http://www.sec.gov/Archives/edgar/data/1355848/000101968715004504|NA|At September 30, 2015, approximately 6.6% of the Company&#x2019;s accounts receivable were due from one customer, and that customer provided 7.9% of the Company&#x2019;s revenues for the nine months ended September 30, 2015.
49|q4-15|10-Q|CREATIVE REALITIES, INC.|1356093|2015-11-18|http://www.sec.gov/Archives/edgar/data/1356093/000121390015008864|NA|LSC&#x2019;s revenue accounted for 50% and 52% of total revenue in 2014 and 2013, respectively.
50|q4-15|10-Q|Mellanox Technologies, Ltd.|1356104|2015-10-30|http://www.sec.gov/Archives/edgar/data/1356104/000110465915074524|NA|Net revenues from significant customers representing 10% or more of net revenues consist of one customer that  accounted for  39 % for the nine months ended September 30, 2015 and 31 % for the nine months ended September 30, 2014.
51|q4-15|10-Q|Brekford Corp.|1357115|2015-11-13|http://www.sec.gov/Archives/edgar/data/1357115/000135448815005007|NA|For the three and nine months ended September&#xA0;30, 2014, the Company did not have any customers that represented more than 10% of the Company&#x2019;s total revenue.
52|q4-15|10-Q|Brekford Corp.|1357115|2015-11-13|http://www.sec.gov/Archives/edgar/data/1357115/000135448815005007|NA|The Company has three major customers that together account for 57% of accounts receivable at September 30, 2014 and 58% of the total revenues earned for the period ended September 30, 2014.
53|q4-15|10-Q|DUNKIN' BRANDS GROUP, INC.|1357204|2015-11-04|http://www.sec.gov/Archives/edgar/data/1357204/000135720415000062|NA|In addition, no individual customer accounted for 10% or more of consolidated net revenue in any period presented.
54|q4-15|10-Q|DUNKIN' BRANDS GROUP, INC.|1357204|2015-11-04|http://www.sec.gov/Archives/edgar/data/1357204/000135720415000062|NA|During these respective periods of 2014, TXDOT represented 7.8% and 8.6%, respectively, of total revenues and a petrochemical operating company represented 8.0% and 8.0%, respectively, of total revenues.
55|q4-15|10-K|PSM HOLDINGS INC|1362180|2015-10-13|http://www.sec.gov/Archives/edgar/data/1362180/000143774915018327|NA|FutureFuel&#x2019;s revenues attributable to the United States and foreign countries (based upon the billing addresses of its customers) were as follows:       Three months ended September 30:     Nine months ended September 30:       2015     2014     2015     2014   United States   $ 106,300     $ 100,925     $ 264,034     $ 247,314   All Foreign Countries   $ 754     $ 2,210     $ 1,705     $ 6,057   Total   $ 107,054     $ 103,135     $ 265,739     $ 253,371     For the three months ended September 30, 2015 and 2014, revenues from Mexico accounted for 0% and 2%, respectively, of total revenues.
56|q4-15|10-Q|Sucampo Pharmaceuticals, Inc.|1365216|2015-11-04|http://www.sec.gov/Archives/edgar/data/1365216/000117184315005981|NA|Concentration of Revenue and Accounts Receivable Significant customers are those which represent 10% or more of the Company&#x2019;s total revenue or gross accounts receivable balance at each respective balance sheet date.
57|q4-15|10-Q|Sucampo Pharmaceuticals, Inc.|1365216|2015-11-04|http://www.sec.gov/Archives/edgar/data/1365216/000117184315005981|NA|During the three months ended September 30, 2015, three customers accounted for 67%, 19% and 6% of net revenues.
58|q4-15|10-Q|BIOSHAFT WATER TECHNOLOGY, INC.|1365784|2015-12-21|http://www.sec.gov/Archives/edgar/data/1365784/000139390515000666|NA|The Company's largest customer accounted for 12.5% and 15.0% of net revenues for the nine months ended September 30, 2015 and 2014 , respectively.
59|q4-15|10-Q|Protea Biosciences Group, Inc.|1335103|2015-11-16|http://www.sec.gov/Archives/edgar/data/1335103/000114420415065904|NA|This customer represented 20% of Tridien's sales in 2014.
60|q4-15|10-Q|MAGNUM HUNTER RESOURCES CORP|1335190|2015-11-09|http://www.sec.gov/Archives/edgar/data/1335190/000133519015000099|NA|Sales to distributors and end customer, which individually exceeded 10% of the Company's revenues for the three-month and nine-month periods ended September 30, 2015 and 2014, are as follows:     Three-Month Period Ended September 30,       2015     2014       US$     %     US$     %   Distributor A     47,064,784       20 %     47,591,686       15 % Distributor B     35,836,733       15 %     35,451,116       11 % Distributor C     32,860,363       14 %     35,788,387       11 % Distributor D     30,305,169       13 %     33,419,979       11 % Distributor E     26,810,505       11 %     28,144,454       9 % Direct Customer F, located in the ROK     7,294,500       3 %     59,332,290       19 % Total     180,172,054       76 %     239,727,912       76 %       Nine-Month Period Ended September 30,       2015     2014       US$     %     US$     %   Distributor A     129,198,965       18 %     130,069,535       16 % Distributor B     107,415,390       15 %     102,885,009       13 % Distributor C     91,297,886       13 %     104,194,093       13 % Distributor D     81,685,215       11 %     102,811,791       13 % Distributor E     76,475,405       11 %     70,356,927       9 % Direct Customer F, located in the ROK     71,380,400       10 %     79,303,190       10 % Total     557,453,261       78 %     589,620,545       74 %   The Company expects revenues from these distributors and the customer to continue to represent a substantial portion of its revenue in the future.
61|q4-15|10-Q|Epazz Inc|1335239|2015-11-23|http://www.sec.gov/Archives/edgar/data/1335239/000101968715004304|NA|LSC contributed 50% and 48% of total revenue during the six months ended June&#xA0;30, 2015 and 2014, respectively.
62|q4-15|10-Q|Epazz Inc|1335239|2015-11-23|http://www.sec.gov/Archives/edgar/data/1335239/000101968715004304|NA|Two major customers accounted for more than 10% each and totaled 37.4% of revenues.
63|q4-15|10-K|Provision Holding, Inc.|1335493|2015-10-13|http://www.sec.gov/Archives/edgar/data/1335493/000101376215000997|NA|No one customer accounted for more than 10% of our revenues on an overall or segment basis for any of the periods presented. 
64|q4-15|10-K|Provision Holding, Inc.|1335493|2015-10-13|http://www.sec.gov/Archives/edgar/data/1335493/000101376215000997|NA| Concentration of Revenue and Accounts Receivable Significant customers are those which represent 10% or more of the Company&#x2019;s total revenue or gross accounts receivable balance at each respective balance sheet date.
65|q4-15|10-Q|Provision Holding, Inc.|1335493|2015-11-23|http://www.sec.gov/Archives/edgar/data/1335493/000101376215001120|NA|A second channel partner represented approximately 11% of total revenues during the three months ended October 31, 2015 .
66|q4-15|10-Q|Provision Holding, Inc.|1335493|2015-11-23|http://www.sec.gov/Archives/edgar/data/1335493/000101376215001120|NA|LSC contributed 48% of total revenue during the nine&#xA0;months ended September 30, 2015 and 2014.
67|q4-15|10-Q|United Development Funding III, LP|1335732|2015-11-16|http://www.sec.gov/Archives/edgar/data/1335732/000114420415065839|NA|For the nine months ended September 30, 2015 and 2014, revenues from Mexico accounted for 0% and 2% of total revenues, respectively.
68|q4-15|10-Q|Goodman Networks Inc|1335982|2015-11-13|http://www.sec.gov/Archives/edgar/data/1335982/000156459015010708|NA| NOTE R - CONCENTRATIONS   In the year ended June 30, 2015, no customer accounted for more than 10% of revenues.
69|q4-15|10-Q|Goodman Networks Inc|1335982|2015-11-13|http://www.sec.gov/Archives/edgar/data/1335982/000156459015010708|NA|During the nine months ended September 30, 2014 , there was one biopharmaceutical company which accounted for approximately 22% of our total revenue.
70|q4-15|10-Q|Under Armour, Inc.|1336917|2015-11-04|http://www.sec.gov/Archives/edgar/data/1336917/000133691715000050|NA|Liberty identifies its reportable segments as (A) those consolidated subsidiaries that represent 10% or more of its consolidated annual revenue, annual Adjusted OIBDA or total assets and (B) those equity method affiliates whose share of earnings represent 10% or more of Liberty's annual pre-tax earnings.
71|q4-15|10-Q|Calumet Specialty Products Partners, L.P.|1340122|2015-11-06|http://www.sec.gov/Archives/edgar/data/1340122/000134012215000070|NA|Customer Concentration During the three and nine months ended September 30, 2015 for the Biomedical market segment, one customer accounted for 28% and 22% of consolidated revenues, respectively.
72|q4-15|10-Q|Calumet Specialty Products Partners, L.P.|1340122|2015-11-06|http://www.sec.gov/Archives/edgar/data/1340122/000134012215000070|NA|Three Months Ended   September 30,   Nine Months Ended   September 30,   2015   2014   2015   2014 Manufacturing 20.0 %   38.5 %   34.6 %   33.5 % Railcar leasing   %     %     %     % Railcar services 3.1 %   3.0 %   2.9 %   2.3 % Sales and Credit Concentration Manufacturing revenues from customers that accounted for more than 10% of total consolidated revenues are outlined in the table below.
73|q4-15|10-Q|Calumet Specialty Products Partners, L.P.|1340122|2015-11-06|http://www.sec.gov/Archives/edgar/data/1340122/000134012215000070|NA|The amount reclassified from accumulated other comprehensive income (loss) into earnings, as a result of the discontinuance of cash flow hedge accounting for certain crude oil, gasoline, jet fuel and diesel derivative instruments at the Shreveport refinery because it was no longer probable that the original forecasted transaction would occur by the end of the originally specified time period, caused the Company to recognize the following gains and losses in the unaudited condensed consolidated statements of operations for the three and nine months ended September 30, 2015 (in millions):   Three Months Ended September 30,   Nine Months Ended September 30,   2015   2014   2015   2014 Realized gain (loss) on derivative instruments $ 0.9   $ 1.0   $ 3.3   $ (2.3 ) The Company recorded the following gains (losses) in its unaudited condensed consolidated statements of operations for the three months ended September 30, 2015 and 2014 related to its derivative instruments not designated as hedges (in millions): Type of Derivative Amount of Gain (Loss) Recognized in Realized Gain (Loss) on Derivative Instruments   Amount of Gain (Loss) Recognized in Unrealized Gain (Loss) on Derivative Instruments Three Months Ended September 30,   Three Months Ended September 30, 2015   2014   2015   2014 Fuel products segment:               Crude oil swaps $ (11.6 )   $ 3.7   $ (13.6 )   $ (21.0 ) Crude oil basis swaps     1.6   (4.5 )   3.0 Crude oil percentage basis swaps (1.3 )       (2.4 )     Crude oil options 7.0       1.1     Gasoline swaps (0.2 )   (4.6 )   8.9   8.4 Diesel swaps 7.3   2.6   7.9   13.3 Diesel crack spread swaps 2.0       (0.3 )     Diesel percentage basis crack spread swaps (0.1 )       (2.6 )     Gasoline crack spread swaps (2.7 )       3.6     Diesel crack spread collars             (0.5 ) Platinum swaps         (0.3 )     Natural gas swaps         (0.4 )     Gasoline crack spread collars             (0.2 ) Specialty products segment:               Natural gas swaps (2.3 )   (0.1 )   (2.5 )   (2.4 ) Total $ (1.9 )   $ 3.2   $ (5.1 )   $ 0.6 The Company recorded the following gains (losses) in its unaudited condensed consolidated statements of operations for the nine months ended September 30, 2015 and 2014 related to its derivative instruments not designated as hedges (in millions): Type of Derivative Amount of Gain (Loss) Recognized in Realized Gain (Loss) on Derivative Instruments   Amount of Gain (Loss) Recognized in Unrealized Gain (Loss) on Derivative Instruments Nine Months Ended September 30,   Nine Months Ended September 30, 2015   2014   2015   2014 Fuel products segment:               Crude oil swaps $ (51.1 )   $ 18.1   $ 42.8   $ (6.5 ) Crude oil basis swaps 1.0   2.8   (5.3 )   2.5 Crude oil percentage basis swaps (1.3 )       0.2     Crude oil options 5.9       0.1     Gasoline swaps (18.6 )   (15.8 )   0.7   9.4 Diesel swaps 66.5   1.0   (59.3 )   10.8 Diesel crack spread swaps 2.9       3.3     Diesel percentage basis crack spread swaps (0.1 )       (5.2 )     Gasoline crack spread swaps (7.4 )       0.4     Jet fuel swaps 1.6   (0.5 )   (1.6 )   (0.9 ) Diesel crack spread collars     1.0       (0.1 ) Platinum swaps         (0.6 )     Natural gas swaps         (0.7 )     Specialty products segment:               Natural gas swaps (6.9 )   1.2   (2.6 )   (1.1 ) Total $ (7.5 )   $ 7.8   $ (27.8 )   $ 14.1 Derivative Positions - Specialty Products Segment Natural Gas Swap Contracts At September 30, 2015 , the Company had the following derivatives related to natural gas purchases in its specialty products segment, none of which are designated as hedges: Natural Gas Swap Contracts by Expiration Dates MMBtu $/MMBtu Fourth Quarter 2015 1,900,000 $ 4.12 Calendar Year 2016 5,880,000 $ 4.22 Calendar Year 2017 4,950,000 $ 3.85 Total 12,730,000 Average price $ 4.06 At December 31, 2014 , the Company had the following derivatives related to natural gas purchases in its specialty products segment, none of which are designated as hedges: Natural Gas Swap Contracts by Expiration Dates MMBtu $/MMBtu First Quarter 2015 1,770,000 $ 4.09 Second Quarter 2015 1,500,000 $ 4.11 Third Quarter 2015 1,500,000 $ 4.11 Fourth Quarter 2015 1,900,000 $ 4.12 Calendar Year 2016 5,880,000 $ 4.22 Calendar Year 2017 1,830,000 $ 4.28 Total 14,380,000 Average price $ 4.18 Natural Gas Collars At September 30, 2015 , the Company had the following derivatives related to natural gas purchases in its specialty products segment, none of which are designated as hedges: Natural Gas Collars by Expiration Dates MMBtu   Average Bought Call ($/MMBtu)   Average Sold Put ($/MMBtu) Fourth Quarter 2015 200,000   $ 4.25   $ 3.85 Calendar Year 2016 600,000   $ 4.25   $ 3.89 Total 800,000         Average price     $ 4.25   $ 3.88 At December 31, 2014 , the Company had the following derivatives related to natural gas purchases in its specialty products segment, none of which are designated as hedges: Natural Gas Collars by Expiration Dates MMBtu   Average Bought Call ($/MMBtu)   Average Sold Put ($/MMBtu) First Quarter 2015 240,000   $ 4.25   $ 3.79 Second Quarter 2015 240,000   $ 4.25   $ 3.79 Third Quarter 2015 240,000   $ 4.25   $ 3.79 Fourth Quarter 2015 200,000   $ 4.25   $ 3.85 Calendar Year 2016 600,000   $ 4.25   $ 3.89 Total 1,520,000         Average price     $ 4.25   $ 3.84 Derivative Positions - Fuel Products Segment Natural Gas Swap Contracts At September 30, 2015 , the Company had the following derivatives related to natural gas purchases in its fuel products segment, none of which are designated as hedges: Natural Gas Swap Contracts by Expiration Dates MMBtu   $/MMBtu Calendar Year 2016 1,320,000   $ 3.39 Total 1,320,000     Average price     $ 3.39 Crude Oil Swap Contracts At September 30, 2015 , the Company had the following derivatives related to crude oil purchases in its fuel products segment, none of which are designated as hedges: Crude Oil Swap Contracts by Expiration Dates Barrels Purchased BPD Average Swap ($/Bbl) Fourth Quarter 2015 93,000   1,011   $ 61.57 Calendar Year 2016 1,512,239   4,132   $ 56.61 Calendar Year 2017 528,520   1,448   $ 56.10 Total 2,133,759 Average price $ 56.70 At December 31, 2014 , the Company had the following derivatives related to crude oil purchases in its fuel products segment, all of which are designated as cash flow hedges: Crude Oil Swap Contracts by Expiration Dates Barrels Purchased   BPD   Average Swap ($/Bbl) First Quarter 2015 315,000   3,500   $ 97.71 Total 315,000         Average price         $ 97.71 At December 31, 2014 , the Company had the following derivatives related to crude oil purchases in its fuel products segment, none of which are designated as hedges: Crude Oil Swap Contracts by Expiration Dates Barrels Purchased   BPD   Average Swap ($/Bbl) First Quarter 2015 1,674,000   18,600   $ 89.55 Second Quarter 2015 91,000   1,000   $ 89.89 Third Quarter 2015 386,400   4,200   $ 69.20 Fourth Quarter 2015 386,400   4,200   $ 69.20 Calendar Year 2016 972,828   2,658   $ 78.02 Total 3,510,628         Average price         $ 81.89 At December 31, 2014 , the Company had the following derivatives related to crude oil sales in its fuel products segment, none of which are designated as hedges: Crude Oil Swap Contracts by Expiration Dates Barrels Sold   BPD   Average Swap ($/Bbl) First Quarter 2015 1,674,000   18,600   $ 84.21 Total 1,674,000         Average price         $ 84.21 Crude Oil Basis Swap Contracts The Company has entered into crude oil basis swaps to mitigate the risk of future changes in pricing differentials between Canadian heavy crude oil and NYMEX WTI crude oil.
74|q4-15|6-K|EUROSEAS LTD.|1341170|2015-10-13|http://www.sec.gov/Archives/edgar/data/1341170/000091957415007324|NA|The amounts presented represent 100% (not our pro-rata share) of amounts related to the Funds, and are based upon historical acquired book value:   Nine Months Ended September 30,   2015   2014         Total revenues $ 52,500   $ 49,276 Operating income 10,072   8,627 Net income 1,431   60   September 30, 2015   December 31, 2014         Total assets $ 692,662   $ 703,130 Total liabilities 389,934   389,413 Total equity 302,728   313,717 
75|q4-15|6-K|EUROSEAS LTD.|1341170|2015-10-13|http://www.sec.gov/Archives/edgar/data/1341170/000091957415007324|NA|For each period presented, nearly 100% of our net revenues resulted from the consultants  marketing efforts, and fees for the two consultants represented nearly all of our selling and marketing expense.
76|q4-15|10-Q|Compass Group Diversified Holdings LLC|1345122|2015-11-04|http://www.sec.gov/Archives/edgar/data/1345122/000134512615000045|NA|Significant Customers During the three months ended September 30, 2015 the Company had one customer which accounted for more than 10% of the Company s revenues (96%).
77|q4-15|10-Q|World Monitor Trust III - Series J|1345991|2015-11-12|http://www.sec.gov/Archives/edgar/data/1345991/000138713115003271|NA|One customer accounted for 14% and 16% of the Company s net revenue for the three months and nine months ended September 30, 2014, respectively.
78|q4-15|10-Q|ESP Resources, Inc.|1346526|2015-11-18|http://www.sec.gov/Archives/edgar/data/1346526/000117184315006410|NA|Balances represent: (a) unbilled amounts arising from the use of the percentage-of-completion method of accounting which may not be billed under the terms of the contract until a later date, (b) incurred costs to be billed under cost reimbursement type contracts, (c) amounts arising from routine lags in billing, or (d) the revenue associated with unapproved change orders or claims when realization is probable and amounts can be reliably determined.
79|q4-15|10-Q|ESP Resources, Inc.|1346526|2015-11-18|http://www.sec.gov/Archives/edgar/data/1346526/000117184315006410|NA|The Company's largest customer accounted for 12.5% and 15.0% of net revenues for the nine months ended September 30, 2015 and 2014 , respectively. 
80|q4-15|10-Q|ESP Resources, Inc.|1346526|2015-11-18|http://www.sec.gov/Archives/edgar/data/1346526/000117184315006410|NA|The United Kingdom and Germany together accounted for approximately 55% , 45% , and 44% of total revenues in the Europe, Middle East and Africa ( EMEA ) region in 2015 , 2014 , and 2013 , respectively.
81|q4-15|10-Q|ESP Resources, Inc.|1346526|2015-11-18|http://www.sec.gov/Archives/edgar/data/1346526/000117184315006410|NA|The following table sets forth the major product category sales for the three months ended September 30, 2015 and 2014 (in millions):     Three Months Ended September 30,   2015   2014 Specialty products:               Lubricating oils $ 143.2   12.6 %   $ 200.3   12.0 % Solvents 73.3   6.4 %   126.0   7.5 % Waxes 32.8   2.9 %   37.9   2.3 % Packaged and synthetic specialty products 80.0   7.0 %   82.1   4.9 % Other 12.7   1.1 %   9.9   0.6 % Total $ 342.0   30.0 %   $ 456.2   27.3 % Fuel products:               Gasoline $ 274.9   24.1 %   $ 408.5   24.4 % Diesel 225.7   19.8 %   330.6   19.7 % Jet fuel 38.6   3.4 %   65.7   3.9 % Asphalt, heavy fuel oils and other 191.7   16.8 %   283.6   16.9 % Total $ 730.9   64.1 %   $ 1,088.4   64.9 % Oilfield services:               Total $ 67.1   5.9 %   $ 131.2   7.8 % Consolidated sales $ 1,140.0   100.0 %   $ 1,675.8   100.0 % The following table sets forth the major product category sales for the nine months ended September 30, 2015 and 2014 (in millions):     Nine Months Ended September 30,   2015 2014 Specialty products: Lubricating oils $ 451.1 13.6 % $ 583.1 13.1 % Solvents 241.1 7.3 % 377.6 8.5 % Waxes 105.7 3.2 % 103.9 2.3 % Packaged and synthetic specialty products 248.9 7.5 % 238.3 5.4 % Other 27.4 0.8 % 27.7 0.6 % Total $ 1,074.2 32.4 % $ 1,330.6 29.9 % Fuel products: Gasoline $ 823.8 24.9 % $ 1,126.4 25.3 % Diesel 690.6 20.8 % 916.0 20.6 % Jet fuel 114.7 3.5 % 151.8 3.4 % Asphalt, heavy fuel oils and other 385.2 11.6 % 685.9 15.4 % Total $ 2,014.3 60.8 % $ 2,880.1 64.7 % Oilfield services: Total $ 226.3 6.8 % $ 241.0 5.4 % Consolidated sales $ 3,314.8 100.0 % $ 4,451.7 100.0 % d. Major Customers During the three and nine months ended September 30, 2015 and 2014 , the Company had no customer that represented 10% or greater of consolidated sales.
82|q4-15|10-Q|CMG HOLDINGS GROUP, INC.|1346655|2015-10-22|http://www.sec.gov/Archives/edgar/data/1346655/000121390015007861|NA|During the three and nine months ended September 30, 2014 for the Biomedical market segment, one customer accounted for 22% and 21% of our consolidated revenues, respectively.
83|q4-15|10-Q|CMG HOLDINGS GROUP, INC.|1346655|2015-10-22|http://www.sec.gov/Archives/edgar/data/1346655/000121390015007861|NA| Significant Customers During the three months ended September 30, 2015 the Company had one customer which accounted for more than 10% of the Company s revenues (96%).
84|q4-15|10-Q|Praxsyn Corp|1346973|2015-11-16|http://www.sec.gov/Archives/edgar/data/1346973/000149315215005539|NA| The following represents summary financial information for Dakota Prairie, presented at 100% (in millions):   Three Months Ended September 30,   Nine Months Ended September 30,   2015   2014   2015   2014 Operating revenue $ 82.3   $     $ 132.4   $   Operating loss $ (18.7 )   $ (2.2 )   $ (40.5 )   $ (4.8 ) Net loss $ (19.1 )   $ (2.2 )   $ (41.4 )   $ (4.8 ) 
85|q4-15|10-Q|Praxsyn Corp|1346973|2015-11-16|http://www.sec.gov/Archives/edgar/data/1346973/000149315215005539|NA|During the year ended December&#xA0;31, 2013 for the Biomedical market segment, one major customer accounted for 17% of consolidated revenues and another major customer accounted for approximately 10% of consolidated revenues.
86|q4-15|10-Q|Praxsyn Corp|1346973|2015-11-16|http://www.sec.gov/Archives/edgar/data/1346973/000149315215005539|NA|Significant Customers   During the year ended June 30, 2015 the Company had one customer which accounted for more than 10% of the Company s revenues (85%).
