,qtr,Form_Type,Company_Name,CIK,Date,Path,Indicator,Phrase
83,q4-15,10-Q,CANTEL MEDICAL CORP,19446,2015-12-10,http://www.sec.gov/Archives/edgar/data/19446/000110465915084042,No,"CONCENTRATIONS OF RISKS   (a) Major customers   For the three and six months ended October 31, 2015, there was one customer who accounted for 100% of the Company s revenues with no account receivable balance at period-end."
84,q4-15,10-Q,CANTEL MEDICAL CORP,19446,2015-12-10,http://www.sec.gov/Archives/edgar/data/19446/000110465915084042,No,"(4)   Includes net revenue from EAS systems, Alpha   and EAS consumables of $86.5 million , $55.5 million and $52.7 million , respectively, representing more than 10% of total revenue."
85,q4-15,10-Q,CANTEL MEDICAL CORP,19446,2015-12-10,http://www.sec.gov/Archives/edgar/data/19446/000110465915084042,No,"Significant customer concentration information is as follows :       Three Months Ended     Nine Months Ended       September 26,     September 27,     September 26,     September 27,       2015     2014     2015     2014                                     Customers individually accounting for more than 10% of net sales     two       two       one       two                                     Percentage of net sales     29%       26%       17%       27%     Comprehensive Loss   Our accumulated other comprehensive loss balance totaled approximately $20.5 million and $10.7 million at September 26, 2015 and December 27, 2014, respectively, and was attributed to all non-owner changes in stockholders  equity and consists of, on an after-tax basis where applicable, foreign currency adjustments resulting from the translation of certain of our subsidiary accounts where the functional currency is not the U.S. Dollar and adjustments related to postretirement benefits."
86,q4-15,10-Q,CANTEL MEDICAL CORP,19446,2015-12-10,http://www.sec.gov/Archives/edgar/data/19446/000110465915084042,No,"Royalty revenues from three franchisees, one of which is a related party franchisee, accounted for approximately 45% and 44% of the Company s total franchise royalty revenues for the thirteen weeks ended September 28, 2014 and September 27, 2015, respectively, and approximately 45% and 44% of the Company s total franchise royalty revenues for the thirty-nine weeks ended September 28, 2014 and September 27, 2015, respectively."
87,q4-15,10-K,VARIAN MEDICAL SYSTEMS INC,203527,2015-11-25,http://www.sec.gov/Archives/edgar/data/203527/000162828015008998,No,"Operating revenues from a customer accounted for 32% and 15% of total operating revenues for the three months and eight months ended August 31, 2015, respectively."
88,q4-15,10-K,VARIAN MEDICAL SYSTEMS INC,203527,2015-11-25,http://www.sec.gov/Archives/edgar/data/203527/000162828015008998,No,"For the nine months ended September 30, 2015, no customers accounted for greater than 10% of the Company s net sales ."
89,q4-15,10-K,VARIAN MEDICAL SYSTEMS INC,203527,2015-11-25,http://www.sec.gov/Archives/edgar/data/203527/000162828015008998,No,"Our properties were located in 38 states as of September 30, 2015 , with properties in one state (Texas) accounting for more than 10% of our total revenues for the three months then ended."
90,q4-15,10-Q,ACME UNITED CORP,2098,2015-11-12,http://www.sec.gov/Archives/edgar/data/2098/000102660815000078,No,"Two customers represented 100% of the revenue during the three and nine months ended September 30, 2014."
91,q4-15,10-K,COHERENT INC,21510,2015-12-01,http://www.sec.gov/Archives/edgar/data/21510/000002151015000035,No,"(3)   Includes net revenue from EAS systems, Alpha   and EAS consumables of $65.2 million , $47.2 million , and $46.4 million , respectively, representing more than 10% of total revenue."
92,q4-15,10-Q,COHU INC,21535,2015-11-05,http://www.sec.gov/Archives/edgar/data/21535/000143774915019789,No,"Significant customer concentration information is as follows :       Three Months Ended     Nine Months Ended       September 26,     September 27,     September 26,     September 27,       2015     2014     2015     2014                                     Customers individually accounting for more than 10% of net sales     two       two       one       two                                     Percentage of net sales     29%       26%       17%       27%   "
93,q4-15,10-Q,COHU INC,21535,2015-11-05,http://www.sec.gov/Archives/edgar/data/21535/000143774915019789,No,No individual customer accounted for more than 10% of consolidated net revenues.
94,q4-15,10-Q,COHU INC,21535,2015-11-05,http://www.sec.gov/Archives/edgar/data/21535/000143774915019789,No,"On May 5, 2014, CGP LLC contributed the equity interests of PHWLV, and the 50% interest in the management fee revenues of PHW Manager to CGPH."
95,q4-15,10-Q/A,CHECKPOINT SYSTEMS INC,215419,2015-11-04,http://www.sec.gov/Archives/edgar/data/215419/000021541915000109,No,"On May 5, 2014, CGP LLC contributed the equity interests of PHWLV, LLC (""PHWLV""), which holds Planet Hollywood Resort and Casino (""Planet Hollywood"") and the 50% interest in the management fee revenues of PHW Manager, LLC (""PHW Manager"") to CGPH."
96,q4-15,10-Q/A,CHECKPOINT SYSTEMS INC,215419,2015-11-04,http://www.sec.gov/Archives/edgar/data/215419/000021541915000109,No,Revenue Recognition   The Company uses the percentage-of-completion method for accounting for long-term aircraft maintenance and modification fixed-price contracts to recognize revenues and receivables for financial reporting purposes.
97,q4-15,10-Q/A,CHECKPOINT SYSTEMS INC,215419,2015-11-04,http://www.sec.gov/Archives/edgar/data/215419/000021541915000109,No,"(2)   Includes net revenue from EAS systems, Alpha   and EAS consumables of $40.1 million , $24.8 million and $24.3 million , respectively, representing more than 10% of total revenue."
98,q4-15,10-Q/A,CHECKPOINT SYSTEMS INC,215419,2015-11-04,http://www.sec.gov/Archives/edgar/data/215419/000021541915000110,No,"Four customers collectively accounted for approximately 50.7% of our Healthcare Disposables segment net sales for the three months ended October 31, 2015."
99,q4-15,10-Q/A,CHECKPOINT SYSTEMS INC,215419,2015-11-04,http://www.sec.gov/Archives/edgar/data/215419/000021541915000110,No,"The following table reflects customers that accounted for more than 10% of net accounts receivable:       September 30,   December 31,     Year Ended December 31,     2015   2014     2014   2013 Company 1   13%   **     17%   ** Company 2   12%   **     9%   ** Company 3   11%   **     8%   ** Company 4   10%   **     7%   ** Company 5   **   22%     **   22% Company 6   **   18%     **   18% Company 7   **   16%     **   16%   _______________________________ ** Less than 10%   Revenue and Cost Concentrations   The following table reflects the concentration of revenue by geographic locations that accounted for more than 10% of net revenue:   LookSmart derives its revenue from two service offerings, or  products : Advertiser Networks and Publisher Solutions."
100,q4-15,10-Q/A,CHECKPOINT SYSTEMS INC,215419,2015-11-04,http://www.sec.gov/Archives/edgar/data/215419/000021541915000110,No,These contracts represented greater than 97% of the Company s revenue for all periods presented.
101,q4-15,10-Q/A,CHECKPOINT SYSTEMS INC,215419,2015-11-04,http://www.sec.gov/Archives/edgar/data/215419/000021541915000110,No,"Our largest customer, Wal-Mart Stores, Inc. and its affiliates, accounted for approximately 20% in 2015 , and 19% of consolidated net sales in 2014 and 2013 ."
102,q4-15,10-Q/A,CHECKPOINT SYSTEMS INC,215419,2015-11-04,http://www.sec.gov/Archives/edgar/data/215419/000021541915000110,No,"Net revenue by country in which Hewlett Packard Enterprise operates was as follows:                                                                                                                                                                                          For the fiscal years ended October 31       2015   2014   2013       In millions   U.S.    $ 20,063    $ 20,833    $ 22,533    The United Kingdom     5,379      5,661      5,740    Other countries     26,665      28,629      29,098    &#x200B; &#x200B; &#x200B;   &#x200B;   &#x200B; &#x200B;   &#x200B;   &#x200B; &#x200B;   &#x200B;   &#x200B; Total net revenue   $ 52,107    $ 55,123    $ 57,371    &#x200B; &#x200B; &#x200B;   &#x200B;   &#x200B; &#x200B;   &#x200B;   &#x200B; &#x200B;   &#x200B;   &#x200B; &#x200B; &#x200B; &#x200B;   &#x200B;   &#x200B; &#x200B;   &#x200B;   &#x200B; &#x200B;   &#x200B;   &#x200B;         As of October 31, 2015, and 2014 only the U.S. represented 10% or more of net assets."
103,q4-15,10-Q,CHECKPOINT SYSTEMS INC,215419,2015-11-04,http://www.sec.gov/Archives/edgar/data/215419/000021541915000114,No,"(4)   Includes net revenue from EAS systems, Alpha   and EAS consumables of $130.1 million , $84.8 million and $77.2 million , respectively, representing more than 10% of total revenue."
104,q4-15,10-Q,CHECKPOINT SYSTEMS INC,215419,2015-11-04,http://www.sec.gov/Archives/edgar/data/215419/000021541915000114,No,"Segment Reporting   The Company has identified reportable segments as those consolidated subsidiaries that represent 10% or more of its revenue, EBITDA (as defined below), or total assets or subsidiaries which the Company believes information about the segment would be useful to the readers of the financial statements from a qualitative perspective."
105,q4-15,10-Q,CHECKPOINT SYSTEMS INC,215419,2015-11-04,http://www.sec.gov/Archives/edgar/data/215419/000021541915000114,No,"In the nine month period ended September 30, 2015, one payer represented $3,951 or 18% of net revenues, respectively."
106,q4-15,10-Q,CHECKPOINT SYSTEMS INC,215419,2015-11-04,http://www.sec.gov/Archives/edgar/data/215419/000021541915000114,No,"Operating revenues from a customer accounted for 32% and 15% of total operating revenues for the three months and eight months ended August 31, 2015, respectively. "
107,q4-15,10-Q,CHECKPOINT SYSTEMS INC,215419,2015-11-04,http://www.sec.gov/Archives/edgar/data/215419/000021541915000114,No,"For the three months ended September 30, 2014, three customers accounted for 32 %, 16 %, and 13 % of the Company s net sales."
