,qtr,Form_Type,Company_Name,CIK,Date,Path,Indicator,Phrase
0,q4-15,10-Q,MFRI INC,914122,2015-12-08,http://www.sec.gov/Archives/edgar/data/914122/000091412215000036,No,"CUSTOMER INFORMATION   No single customer accounted for 10% or more of consolidated net sales for the three months and nine months ended September 30, 2015 and 2014. "
1,q4-15,10-Q,MFRI INC,914122,2015-12-08,http://www.sec.gov/Archives/edgar/data/914122/000091412215000036,No,"The supplemental pro forma amount of the Company s revenues and net income (loss) had the Renin Transaction been consummated as of January 1, 2012 was as follows (in thousands):                         (unaudited)   Revenue   Income (1) Pro forma from 1/1/2013 - 12/31/2013 $ 104,987    43,639  Pro forma from 1/1/2012 - 12/31/2012 $ 107,303    (28,794)   (1)  Amount s represent income from continuing operations   The methodology utilized to fair value the assets acquired for the Renin and Hoffman s acquisitions in 2013 and the 2014 Acquisitions was as follows:     Trade Receivables   Trade receivables were recorded at fair value using the cost approach with level 3 inputs based on the percentage of gross receivables collected in a trailing eighteen month period ending in October 2013 for Renin."
2,q4-15,10-Q,FEI CO,914329,2015-11-02,http://www.sec.gov/Archives/edgar/data/914329/000091432915000113,No,"The Magnesia Specialties segment, which accounted for 9% of 2014 consolidated net sales, produces magnesia-based chemicals products used in industrial, agricultural and environmental applications and dolomitic lime sold primarily to customers in the steel industry."
3,q4-15,10-Q,FEI CO,914329,2015-11-02,http://www.sec.gov/Archives/edgar/data/914329/000091432915000113,No," Lennar Homebuilding Investments in Unconsolidated Entities Summarized condensed financial information on a combined 100% basis related to Lennar Homebuilding s unconsolidated entities that are accounted for by the equity method was as follows: Statements of Operations   Years Ended November 30, (In thousands) 2014   2013   2012 Revenues $ 263,395   570,910   353,902 Costs and expenses 291,993   425,282   418,905 Other income     14,602   10,515 Net earnings (loss) of unconsolidated entities $ (28,598 )   160,230   (54,488 ) Lennar Homebuilding equity in earnings (loss) from unconsolidated entities (1) $ (355 )   23,803   (26,672 ) (1) For the year ended November 30, 2014, Lennar Homebuilding equity in loss from unconsolidated entities related primarily to the Company's share of operating losses of Lennar Homebuilding unconsolidated entities, which included $4.6 million of valuation adjustments related to assets of Lennar Homebuilding's unconsolidated entities, partially offset by $4.7 million of equity in earnings as a result of third-party land sales by one unconsolidated entity."
4,q4-15,10-Q,FEI CO,914329,2015-11-02,http://www.sec.gov/Archives/edgar/data/914329/000091432915000113,No,"TOTAL SALES Total sales to significant customers as a percentage of total revenues for the three- and nine -month periods ended September 30, 2015 and 2014 were as follows:     Three Months Ended   Nine Months Ended     September 30,   September 30,     2015 (1)   2014   2015 (1)   2014 (1) Customer A   70 %   67 %   75 %   45 % Customer B       10 %       16 %     70 %   77 %   75 %   61 % (1)    The     symbol represents less than 10% of total revenues. "
5,q4-15,10-Q,TRANS WORLD CORP,914577,2015-11-10,http://www.sec.gov/Archives/edgar/data/914577/000110465915077488,No,"AGGREGATES BUSINESS Reportable Segments    Mid-America Group    Southeast Group    West Group Operating Locations    Indiana, Iowa, northern Kansas, Kentucky, Maryland, Minnesota, Missouri, eastern Nebraska, North Carolina, Ohio, South Carolina, Virginia, Washington and West Virginia    Alabama, Florida, Georgia, Tennessee, Nova Scotia and the Bahamas    Arkansas, Colorado, southern Kansas, Louisiana, western Nebraska, Nevada, Oklahoma, Texas, Utah and Wyoming The Corporation has a Cement segment, which was acquired July 1, 2014 and accounted for 8% of 2014 consolidated net sales."
6,q4-15,10-Q,TRANS WORLD CORP,914577,2015-11-10,http://www.sec.gov/Archives/edgar/data/914577/000110465915077488,No,No single customer accounted for 10% or more of consolidated net sales
7,q4-15,10-Q,TRANS WORLD CORP,914577,2015-11-10,http://www.sec.gov/Archives/edgar/data/914577/000110465915077488,No,"For the three months ended September 28, 2014 , three customers accounted for 10 percent or more of our total net revenue, representing approximately 37 percent, 20 percent and 10 percent of our total net revenue, respectively."
8,q4-15,10-K,ModusLink Global Solutions Inc,914712,2015-10-14,http://www.sec.gov/Archives/edgar/data/914712/000119312515343814,No,"Dollars in thousands   Three Months Ended September 30, 2015 Redbox   Coinstar   ecoATM   All Other   Corporate Unallocated   Total Revenue $ 395,372   $ 85,677   $ 30,965   $ 41   $     $ 512,055 Expenses:                       Direct operating 269,022   41,249   28,583   786   559   340,199 Marketing 4,180   1,439   1,134   262   116   7,131 Research and development         1,201       313   1,514 General and administrative 31,788   8,502   3,105   933   3,490   47,818 Segment operating income (loss) 90,382   34,487   (3,058 )   (1,940 )   (4,478 )   115,393 Less: depreciation, amortization and other (27,754 )   (7,942 )   (6,788 )   (704 )       (43,188 ) Operating income (loss) 62,628   26,545   (9,846 )   (2,644 )   (4,478 )   72,205 Loss from equity method investments, net                 (328 )   (328 ) Interest expense, net                 (11,973 )   (11,973 ) Other, net                 (1,384 )   (1,384 ) Income (loss) from continuing operations before income taxes $ 62,628   $ 26,545   $ (9,846 )   $ (2,644 )   $ (18,163 )   $ 58,520 Dollars in thousands   Three Months Ended September 30, 2014 Redbox   Coinstar   ecoATM   All Other   Corporate Unallocated   Total Revenue $ 435,083   $ 85,074   $ 29,733   $ 9   $     $ 549,899 Expenses:                       Direct operating 308,123   42,428   26,411   577   1,903   379,442 Marketing 5,419   1,834   973   239   678   9,143 Research and development 15   64   1,360   728   832   2,999 General and administrative 33,249   7,313   3,027   858   3,139   47,586 Segment operating income (loss) 88,277   33,435   (2,038 )   (2,393 )   (6,552 )   110,729 Less: depreciation, amortization and other (36,685 )   (8,989 )   (4,297 )   (74 )       (50,045 ) Operating income (loss) 51,592   24,446   (6,335 )   (2,467 )   (6,552 )   60,684 Loss from equity method investments, net                 (11,352 )   (11,352 ) Interest expense, net                 (12,465 )   (12,465 ) Other, net                 (1,352 )   (1,352 ) Income (loss) from continuing operations before income taxes $ 51,592   $ 24,446   $ (6,335 )   $ (2,467 )   $ (31,721 )   $ 35,515 Dollars in thousands   Nine Months Ended September 30, 2015 Redbox   Coinstar   ecoATM   All Other   Corporate Unallocated   Total Revenue $ 1,353,881   $ 235,286   $ 76,776   $ 117   $     $ 1,666,060 Expenses:                       Direct operating 913,401   117,870   78,616   3,055   2,060   1,115,002 Marketing 13,271   3,849   5,013   840   625   23,598 Research and development         4,206   (84 )   1,515   5,637 General and administrative 99,859   24,065   7,167   6,084   7,982   145,157 Restructuring and lease termination costs (Note 11) 15,174   550   127           15,851 Goodwill impairment (Note 6)         85,890           85,890 Segment operating income (loss) 312,176   88,952   (104,243 )   (9,778 )   (12,182 )   274,925 Less: depreciation, amortization and other (92,424 )   (24,197 )   (18,995 )   (2,050 )       (137,666 ) Operating income (loss) 219,752   64,755   (123,238 )   (11,828 )   (12,182 )   137,259 Loss from equity method investments, net                 (593 )   (593 ) Interest expense, net                 (36,227 )   (36,227 ) Other, net                 (3,088 )   (3,088 ) Income (loss) from continuing operations before income taxes $ 219,752   $ 64,755   $ (123,238 )   $ (11,828 )   $ (52,090 )   $ 97,351 Dollars in thousands   Nine Months Ended September 30, 2014 Redbox   Coinstar   ecoATM   All Other   Corporate Unallocated   Total Revenue $ 1,390,970   $ 233,707   $ 69,478   $ 33   $     $ 1,694,188 Expenses:                       Direct operating 989,100   120,354   64,729   1,421   5,214   1,180,818 Marketing 15,412   4,397   2,568   620   2,275   25,272 Research and development 41   486   4,535   2,035   2,788   9,885 General and administrative 105,642   21,479   9,470   2,352   9,847   148,790 Restructuring and lease termination costs (Note 11) 534   23               557 Segment operating income (loss) 280,241   86,968   (11,824 )   (6,395 )   (20,124 )   328,866 Less: depreciation, amortization and other (114,872 )   (26,473 )   (11,821 )   (315 )       (153,481 ) Operating income (loss) 165,369   60,495   (23,645 )   (6,710 )   (20,124 )   175,385 Loss from equity method investments, net                 (31,261 )   (31,261 ) Interest expense, net                 (35,045 )   (35,045 ) Other, net                 (386 )   (386 ) Income (loss) from continuing operations before income taxes $ 165,369   $ 60,495   $ (23,645 )   $ (6,710 )   $ (86,816 )   $ 108,693 Significant Retailer Relationships The following retailers accounted for 10% or more of our consolidated revenue:   Three Months Ended   Nine Months Ended   September 30,   September 30,   2015   2014   2015   2014 Wal-Mart Stores Inc. 16.6 %   15.4 %   16.5 %   15.3 % Walgreen Co. 12.9 %   13.2 %   13.6 %   13.8 % "
9,q4-15,10-K,ModusLink Global Solutions Inc,914712,2015-10-14,http://www.sec.gov/Archives/edgar/data/914712/000119312515343814,No,"For the three months ended September 30, 2014, sales to one of our Company's customers accounted for 100% of sales."
10,q4-15,10-K,ModusLink Global Solutions Inc,914712,2015-10-14,http://www.sec.gov/Archives/edgar/data/914712/000119312515343814,No,"Certain risks and concentrations We have certain customers whose net sales individually represented 10 percent or more of our total net sales, or whose net trade accounts receivable balance individually represented 10 percent or more of our total net trade accounts receivable, as follows: For the three months ended September 30, 2015 , Energy Management Products, LLC , a distributor for the U.S. Navy, accounted for approximately 74 percent of net sales, and sales of products for the U.S. Navy were approximately 82 percent of net sales."
11,q4-15,10-K,ModusLink Global Solutions Inc,914712,2015-10-14,http://www.sec.gov/Archives/edgar/data/914712/000119312515343814,No,"The following table sets forth the percentage of revenues recognized under our collaboration agreements and product sales to the specialty pharmacies that represent 10% or more of total revenues during one or more of the periods presented:   Three Months Ended September 30,   Nine Months Ended September 30,   2015   2014   2015   2014 Collaboration agreements:               Merck 30 %      %   11 %     % Product sales:               Diplomat Specialty Pharmacy 66 %   108  %   79 %   100 % Swedish Orphan Biovitrum 4 %   (8 )%   10 %     % "
12,q4-15,10-K,ModusLink Global Solutions Inc,914712,2015-10-14,http://www.sec.gov/Archives/edgar/data/914712/000119312515343814,No,"Revenues derived from sales through Ascend Technology accounted for 16% and 11% of the Company s total revenues for the nine months ended September 30, 2015 and 2014, respectively."
13,q4-15,10-Q,ModusLink Global Solutions Inc,914712,2015-12-10,http://www.sec.gov/Archives/edgar/data/914712/000119312515400270,No,"In the thirty-nine week periods ended September 27, 2015 and September 28, 2014 , our top 10 customers accounted for approximately 29.9% and 29.2% of our total annual net revenue, respectively."
14,q4-15,10-Q,EVEREST REINSURANCE HOLDINGS INC,914748,2015-11-16,http://www.sec.gov/Archives/edgar/data/914748/000091474815000026,No,"For the three months ended September 30, 2014 , the Company did not have any customers that accounted for 10% or more of total revenue."
15,q4-15,10-Q,KEYCORP /NEW/,91576,2015-11-02,http://www.sec.gov/Archives/edgar/data/91576/000119312515361939,No,"For the three months ended September 27, 2014 , the Company had sales through two just-in-time distributors, which each represented 14% and 12% of total revenue, respectively."
16,q4-15,10-Q,KEYCORP /NEW/,91576,2015-11-02,http://www.sec.gov/Archives/edgar/data/91576/000119312515361939,No,"No country outside the United States accounted for more than 10% of the Company's consolidated revenues during the three and nine months ended September 30, 2015 and 2014."
17,q4-15,10-Q,DSP GROUP INC /DE/,915778,2015-11-09,http://www.sec.gov/Archives/edgar/data/915778/000143774915020237,No,"Other represents less than 1% of our gross consolidated revenue, and includes fees students pay when submitting an enrollment application and non-tuition revenues such as renting classroom space."
18,q4-15,10-Q,DSP GROUP INC /DE/,915778,2015-11-09,http://www.sec.gov/Archives/edgar/data/915778/000143774915020237,No,"Major Customers The Company s largest customers accounted for the following total percentage of net sales:     Three Months Ended September 30,     Six Months Ended September 30,   Sales   2015     2014     2015     2014   Customer A     46 %     53 %     48 %     53 % Customer B     21 %     21 %     20 %     22 % Customer C     21 %     7 %     19 %     6 % The Company s largest customers accounted for the following total percentage of accounts receivable trade: Accounts receivable - trade   September 30, 2015     March 31, 2015   Customer A     35 %     48 % Customer B     21 %     16 % Customer C     14 %     12 %   The Company had no suppliers that accounted for more than 10% of inventory purchases for the three and six months ended September 30, 2015."
19,q4-15,10-Q,DSP GROUP INC /DE/,915778,2015-11-09,http://www.sec.gov/Archives/edgar/data/915778/000143774915020237,No,"Table 3.7: Expected Maturities and Weighted-Average Yields of Securities     September 30, 2015 (Dollars in millions)   Due in 1 Year or Less   Due   1 Year through 5 Years   Due   5 Years through 10 Years   Due   10 Years   Total Fair value of securities available for sale: U.S. Treasury securities   $ 603   $ 3,841   $ 1   $ 0   $ 4,445 Corporate debt securities guaranteed by U.S. government agencies   0   326   29   0   355 RMBS:                     Agency   272   14,756   9,583   0   24,611 Non-agency   8   1,038   1,635   473   3,154 Total RMBS   280   15,794   11,218   473   27,765 CMBS:                     Agency   80   1,829   1,517   20   3,446 Non-agency   133   497   1,144   0   1,774 Total CMBS   213   2,326   2,661   20   5,220 Other ABS   153   1,135   195   0   1,483 Other securities   51   5   17   90   163 Total securities available for sale   $ 1,300   $ 23,427   $ 14,121   $ 583   $ 39,431 Amortized cost of securities available for sale   $ 1,303   $ 23,143   $ 13,787   $ 520   $ 38,753 Weighted-average yield for securities available for sale (1)   1.16 %   2.06 %   2.92 %   6.58 %   2.40 % Carrying value of securities held to maturity: U.S. Treasury securities   $ 0   $ 198   $ 0   $ 0   $ 198 Agency RMBS   14   1,302   16,079   3,219   20,614 Agency CMBS   0   102   2,410   387   2,899 Total securities held for maturity   $ 14   $ 1,602   $ 18,489   $ 3,606   $ 23,711 Fair value of securities held to maturity   $ 15   $ 1,649   $ 19,459   $ 3,790   $ 24,913 Weighted-average yield for securities held to maturity (1)   5.67 %   2.77 %   2.50 %   3.33 %   2.64 % __________ (1) The weighted-average yield represents the effective yield for the investment securities and is calculated based on the amortized cost of each security. "
20,q4-15,10-Q,DSP GROUP INC /DE/,915778,2015-11-09,http://www.sec.gov/Archives/edgar/data/915778/000143774915020237,No,"Medtronic has several separately licensed products that generate royalty revenue for SurModics, none of which represented more than 6% of SurModics  total revenue."
21,q4-15,10-Q,DSP GROUP INC /DE/,915778,2015-11-09,http://www.sec.gov/Archives/edgar/data/915778/000143774915020237,No,"For the three months ended October 31, 2015 and October 31, 2014 , no customer accounted for 10% of the Company's consolidated net sales."
22,q4-15,10-Q,DSP GROUP INC /DE/,915778,2015-11-09,http://www.sec.gov/Archives/edgar/data/915778/000143774915020237,No," The following retailers accounted for 10% or more of our consolidated revenue:   Three Months Ended   Nine Months Ended   September 30,   September 30,   2015   2014   2015   2014 Wal-Mart Stores Inc. 16.6 %   15.4 %   16.5 %   15.3 % Walgreen Co. 12.9 %   13.2 %   13.6 %   13.8 % "
23,q4-15,10-Q,DSP GROUP INC /DE/,915778,2015-11-09,http://www.sec.gov/Archives/edgar/data/915778/000143774915020237,No,"For t he three and nine -month period s ended September 30 , 201 4 ,   none of our customers accounted for more than 10% of our revenues. "
24,q4-15,10-Q,ALBEMARLE CORP,915913,2015-11-06,http://www.sec.gov/Archives/edgar/data/915913/000091591315000034,No,"For the three months ended October 3, 2015 , the Company had sales through two just-in-time distributors, which each represented 15% and 12% of total revenue, respectively."
25,q4-15,10-Q,MARTIN MARIETTA MATERIALS INC,916076,2015-11-05,http://www.sec.gov/Archives/edgar/data/916076/000156459015009552,No,"Corporation, accounted for approximately 10% of the Company s consolidated net sales in 2014 and approximately 12% of the Company s consolidated net sales in the nine months ended September 30, 2015, which sales were in the bottom-weight woven fabrics segment."
26,q4-15,10-Q,MARTIN MARIETTA MATERIALS INC,916076,2015-11-05,http://www.sec.gov/Archives/edgar/data/916076/000156459015009552,No,"Information regarding the significant effects of affiliated reinsurance included on the consolidated statements of operations and comprehensive income (loss) was as follows:   Three Months   Ended  September 30,   Nine Months   Ended  September 30,   2015   2014   2015   2014   (In millions) Premiums               Reinsurance assumed $ 164   $ 146   $ 508   $ 515 Reinsurance ceded (9 )   (7 )   (28 )   (29 ) Net premiums $ 155   $ 139   $ 480   $ 486 Universal life and investment-type product policy fees               Reinsurance assumed $ 20   $ 13   $ 46   $ 33 Reinsurance ceded (43 )   (94 )   (117 )   (231 ) Net universal life and investment-type product policy fees $ (23 )   $ (81 )   $ (71 )   $ (198 ) Other revenues               Reinsurance assumed $     $ (3 )   $     $   Reinsurance ceded 155   169   467   491 Net other revenues $ 155   $ 166   $ 467   $ 491 Policyholder benefits and claims               Reinsurance assumed $ 164   $ 122   $ 484   $ 477 Reinsurance ceded (38 )   (49 )   (89 )   (124 ) Net policyholder benefits and claims $ 126   $ 73   $ 395   $ 353 Interest credited to policyholder account balances               Reinsurance assumed $ 9   $ 8   $ 24   $ 25 Reinsurance ceded (23 )   (27 )   (67 )   (79 ) Net interest credited to policyholder account balances $ (14 )   $ (19 )   $ (43 )   $ (54 ) Other expenses               Reinsurance assumed $ 53   $ 51   $ 169   $ 218 Reinsurance ceded 149   152   444   459 Net other expenses $ 202   $ 203   $ 613   $ 677 Information regarding the significant effects of affiliated reinsurance included on the consolidated balance sheets was as follows at:   September 30, 2015   December 31, 2014   Assumed   Ceded   Assumed   Ceded   (In millions) Assets               Premiums, reinsurance and other receivables $ 248   $ 15,513   $ 257   $ 15,453 Deferred policy acquisition costs and value of business acquired 425   (200 )   370   (231 ) Total assets $ 673   $ 15,313   $ 627   $ 15,222 Liabilities               Future policy benefits $ 1,347   $ (6 )   $ 1,146   $   Policyholder account balances 353       288     Other policy-related balances 197   44   264   32 Other liabilities 6,529   13,185   6,610   13,545 Total liabilities $ 8,426   $ 13,223   $ 8,308   $ 13,577 The Company ceded two blocks of business to two affiliates on a 75% coinsurance with funds withheld basis."
27,q4-15,10-Q,MARTIN MARIETTA MATERIALS INC,916076,2015-11-05,http://www.sec.gov/Archives/edgar/data/916076/000156459015009552,No,"Net sales for the F-35 program represented approximately 20% of our total consolidated net sales for both the quarter and nine months ended September 27, 2015 and 17% of our total consolidated net sales for both the quarter and nine months ended September 28, 2014. "
28,q4-15,10-Q,MARTIN MARIETTA MATERIALS INC,916076,2015-11-05,http://www.sec.gov/Archives/edgar/data/916076/000156459015009552,No,"The following tables summarize assets and liabilities measured at fair value as of September 30, 2015 and December 31, 2014, segregated by the level of the valuation inputs within the fair value hierarchy utilized to measure fair value:       September 30, 2015       Level 1     <font style=""font-size: 8pt;""> Level 2     Level 3     Total       Inputs     Inputs     Inputs     Fair Value   Recurring:                                 Investment securities available for sale:                                 Residential mortgage-backed securities   $ -     $ 22,381     $ -     $ 22,381   SBA pools     -       2,646       -       2,646   Obligations of states and political subdivisions     -       10,343       -       10,343   Government-sponsored enterprise equity securities     -       125       -       125   <td style=""text-align: left; text-indent: 8.1pt;"">Redeemable common stock     -       -       (2,257 )     (2,257 ) Nonrecurring:                                 Foreclosed real estate     -       -       1,975       1,975   Collateral-dependent impaired loans     -       -       1,914       1,914   Mortgage servicing rights     -       -       315       315         December 31, 2014       Level 1     Level 2     Level 3     Total       Inputs     Inputs     Inputs     <td style=""text-align: center; border-bottom-color: black; border-bottom-width: 1pt; border-bottom-style: solid;"" colspan=""2""> Fair Value   Recurring:                                 Investment securities available for sale:                                 Residential mortgage-backed securities   $ -     $ 22,545     $ -     $ 22,545   SBA pools     -       1,832       -       1,832   Obligations of states and political subdivisions     -       9,698       -       9,698   Government-sponsored enterprise equity securities     -       102       -       102   Redeemable common stock     -       -       (2,533 )     (2,533 ) Nonrecurring:                                 Foreclosed real estate     -       -       3,656       3,656   Collateral-dependent impaired loans   <td style=""text-align: left;"">  -       -       3,002       3,002   Mortgage servicing rights     -       -       646       646     The following tables present additional quantitative information about the unobservable inputs used in the fair value measurement of mortgage servicing rights measured on a non-recurring basis that were categorized within Level 3 of the fair value hierarchy:       Fair Value at September 30, 2015     Valuation Technique   Unobservable Input   Range       (in thousands)                                       Mortgage servicing rights   $ 315     Discounted cash flows (1)   Prepayment PSA     157   335                   Discount rate     8.50%   9.25%                   Maturity (months) WAM     37   325   <tr style=""vertical-align: bottom; background-color: white;"">                 Costs to service     $ 65 - $750         Fair Value at December 31, 2014     Valuation Technique   Unobservable Input   Range       (in thousands)                                       Mortgage servicing rights   $ 646     Discounted cash flows (1)   Prepayment PSA     157- 335                   Discount rate     8.50%   9.25%                 Maturity (months) WAM     37- 325                   Costs to service     $ 65 - $750     (1) The estimated fair value on mortgage servicing rights is determined through a cash flow analysis performed at the loan level and is based on the objective attributes of the portfolio (i.e., note rate, loan amount, etc.)"
29,q4-15,10-Q,MARTIN MARIETTA MATERIALS INC,916076,2015-11-05,http://www.sec.gov/Archives/edgar/data/916076/000156459015009552,No,"The Company's top ten largest customers accounted for approximately 38% , 37% and 40% of its consolidated revenue for the fiscal years ended September 30, 2015, 2014 and 2013, respectively."
30,q4-15,10-Q,HEALTH NET INC,916085,2015-11-03,http://www.sec.gov/Archives/edgar/data/916085/000091608515000016,No,"For the fiscal quarter and six months ended September 28, 2014, American Tower Corporation accounted for 9.5% and 9.8% of consolidated revenue."
31,q4-15,10-Q,TRACTOR SUPPLY CO /DE/,916365,2015-11-05,http://www.sec.gov/Archives/edgar/data/916365/000091636515000103,No,"For the nine months ended September 30, 2015,  three customers accounted for approximately 35% or $1,353,000 of our total revenue and had trade receivables at September 30, 2015 of $792,000, all of which was collected subsequent to September 30, 2015."
32,q4-15,10-Q,TRACTOR SUPPLY CO /DE/,916365,2015-11-05,http://www.sec.gov/Archives/edgar/data/916365/000091636515000103,No,"Investments in which the Company s interest is less than 20% and which are not classified as available-for-sale securities, are accounted for under the cost method of accounting, and are carried at the lower of cost or net realizable value."
33,q4-15,10-Q,HELEN OF TROY LTD,916789,2015-10-13,http://www.sec.gov/Archives/edgar/data/916789/000155837015001873,No,Major customers and accounts receivable   Major customers represent any customer that accounts for more than 10% of revenues for the year.
